{
  "$schema": "https://json-schema.org/draft/2020-12/schema",
  "$id": "https://schemas.local.invalid/opencode/execution-manifest.v1.schema.json",
  "title": "execution-manifest v1",
  "type": "object",
  "additionalProperties": false,
  "required": [
    "schema_version",
    "plan_id",
    "plan_revision",
    "design_id",
    "design_revision",
    "requirements_id",
    "requirements_revision",
    "repository",
    "design",
    "patch",
    "preconditions",
    "policy",
    "files",
    "commit"
  ],
  "properties": {
    "schema_version": {
      "const": "execution-manifest/v1"
    },
    "plan_id": {
      "type": "string",
      "minLength": 1,
      "pattern": "^[A-Za-z0-9][A-Za-z0-9_-]{0,63}$"
    },
    "plan_revision": {
      "type": "integer",
      "minimum": 1
    },
    "design_id": {
      "type": "string",
      "minLength": 1,
      "pattern": "^[A-Za-z0-9][A-Za-z0-9_-]{0,63}$"
    },
    "design_revision": {
      "type": "integer",
      "minimum": 1
    },
    "requirements_id": {
      "type": "string",
      "minLength": 1,
      "pattern": "^[A-Za-z0-9][A-Za-z0-9_-]{0,63}$"
    },
    "requirements_revision": {
      "type": "integer",
      "minimum": 1
    },
    "repository": {
      "type": "object",
      "additionalProperties": false,
      "required": [
        "id",
        "object_format",
        "base_commit"
      ],
      "properties": {
        "id": {
          "type": "string",
          "minLength": 1
        },
        "object_format": {
          "const": "sha1"
        },
        "base_commit": {
          "type": "string",
          "minLength": 1,
          "pattern": "^[0-9a-f]{40}$"
        }
      }
    },
    "design": {
      "type": "object",
      "additionalProperties": false,
      "required": [
        "artifact",
        "sha256"
      ],
      "properties": {
        "artifact": {
          "type": "string",
          "minLength": 1,
          "pattern": "^(?!/)(?!.*(?:^|/)\\.{1,2}(?:/|$))[A-Za-z0-9_.-]+(?:/[A-Za-z0-9_.-]+)*$"
        },
        "sha256": {
          "type": "string",
          "minLength": 1,
          "pattern": "^[0-9a-f]{64}$"
        }
      }
    },
    "patch": {
      "type": "object",
      "additionalProperties": false,
      "required": [
        "artifact",
        "sha256",
        "format"
      ],
      "properties": {
        "artifact": {
          "type": "string",
          "minLength": 1,
          "pattern": "^(?!/)(?!.*(?:^|/)\\.{1,2}(?:/|$))[A-Za-z0-9_.-]+(?:/[A-Za-z0-9_.-]+)*$"
        },
        "sha256": {
          "type": "string",
          "minLength": 1,
          "pattern": "^[0-9a-f]{64}$"
        },
        "format": {
          "const": "git-unified-diff"
        }
      }
    },
    "preconditions": {
      "type": "object",
      "additionalProperties": false,
      "required": [
        "caller_head_equals_base",
        "caller_clean",
        "no_git_operation_in_progress"
      ],
      "properties": {
        "caller_head_equals_base": {
          "const": true
        },
        "caller_clean": {
          "const": true
        },
        "no_git_operation_in_progress": {
          "const": true
        }
      }
    },
    "policy": {
      "type": "object",
      "additionalProperties": false,
      "required": [
        "allowed_paths",
        "protected_prefixes",
        "allowed_operations",
        "regular_file_mode",
        "allow_offset",
        "allow_three_way",
        "allow_partial",
        "allow_symlinks",
        "allow_binary"
      ],
      "properties": {
        "allowed_paths": {
          "type": "array",
          "items": {
            "type": "string",
            "minLength": 1,
            "pattern": "^(?!/)(?!.*(?:^|/)\\.{1,2}(?:/|$))[A-Za-z0-9_.-]+(?:/[A-Za-z0-9_.-]+)*$"
          },
          "minItems": 1,
          "uniqueItems": true
        },
        "protected_prefixes": {
          "type": "array",
          "items": {
            "type": "string",
            "minLength": 1,
            "pattern": "^(?!/)(?!.*(?:^|/)\\.{1,2}(?:/|$))[A-Za-z0-9_.-]+(?:/[A-Za-z0-9_.-]+)*$"
          },
          "uniqueItems": true
        },
        "allowed_operations": {
          "type": "array",
          "items": {
            "type": "string",
            "enum": [
              "create",
              "modify",
              "delete"
            ]
          },
          "minItems": 1,
          "uniqueItems": true
        },
        "regular_file_mode": {
          "const": "100644"
        },
        "allow_offset": {
          "const": false
        },
        "allow_three_way": {
          "const": false
        },
        "allow_partial": {
          "const": false
        },
        "allow_symlinks": {
          "const": false
        },
        "allow_binary": {
          "const": false
        }
      }
    },
    "files": {
      "type": "array",
      "items": {
        "type": "object",
        "additionalProperties": false,
        "required": [
          "path",
          "operation",
          "base_blob"
        ],
        "properties": {
          "path": {
            "type": "string",
            "minLength": 1,
            "pattern": "^(?!/)(?!.*(?:^|/)\\.{1,2}(?:/|$))[A-Za-z0-9_.-]+(?:/[A-Za-z0-9_.-]+)*$"
          },
          "operation": {
            "type": "string",
            "enum": [
              "create",
              "modify",
              "delete"
            ]
          },
          "base_blob": {
            "anyOf": [
              {
                "type": "string",
                "minLength": 1,
                "pattern": "^[0-9a-f]{40}$"
              },
              {
                "type": "null"
              }
            ]
          }
        },
        "allOf": [
          {
            "if": {
              "properties": {
                "operation": {
                  "const": "create"
                }
              }
            },
            "then": {
              "properties": {
                "base_blob": {
                  "const": null
                }
              }
            },
            "else": {
              "properties": {
                "base_blob": {
                  "type": "string",
                  "minLength": 1,
                  "pattern": "^[0-9a-f]{40}$"
                }
              }
            }
          }
        ]
      },
      "minItems": 1
    },
    "commit": {
      "type": "object",
      "additionalProperties": false,
      "required": [
        "message",
        "name",
        "email",
        "timestamp"
      ],
      "properties": {
        "message": {
          "type": "string",
          "minLength": 1
        },
        "name": {
          "type": "string",
          "minLength": 1
        },
        "email": {
          "type": "string",
          "minLength": 1
        },
        "timestamp": {
          "type": "string",
          "minLength": 1,
          "pattern": "^\\d{4}-\\d{2}-\\d{2}T\\d{2}:\\d{2}:\\d{2}Z$"
        }
      }
    }
  }
}
